{
  "auditId": "audit_20260709_0001",
  "eventType": "kcp_session_completed",
  "timestamp": "2026-07-09T14:30:00Z",
  "actor": {
    "actorId": "agent_kcp_engine",
    "actorType": "kcp_engine",
    "actorName": "KAVEEP KCP Engine"
  },
  "target": {
    "targetId": "kcp_session_0001",
    "targetType": "kcp_session"
  },
  "action": "Completed KCP verification session and issued verification result.",
  "result": "success",
"riskLevel": "moderate",
  "policyRefs": [
    "policy_kcp_001",
    "policy_evidence_001"
  ],
  "evidenceRefs": [
    "evidence_000045",
    "evidence_000112",
    "evidence_000205"
  ],
  "knowledgeRefs": [
    "knowledge_000001"
  ],
  "agentRefs": [
    "agent_reviewer_001",
    "agent_reviewer_002",
    "agent_reviewer_003"
  ],
  "kcpSessionRef": "kcp_session_0001",
  "previousAuditRef": "audit_20260709_0000",
  "verification": {
    "verificationStatus": "verified",
    "verificationLevel": "verified",
    "confidence": 0.94,
    "consensusScore": 0.91,
    "evidenceCount": 3,
    "independentAgentCount": 3,
    "policyPassed": true
  },
  "notes": "Consensus reached after independent evaluation by multiple agents. Verification result issued as verified.",
  "metadata": {
    "schemaVersion": "0.1.0",
    "environment": "development"
  },
  "extensions": {},
  "createdAt": "2026-07-09T14:30:00Z"
}
